{
  "skillId": "design-discovery",
  "name": "Design Discovery",
  "purpose": "Capture visual identity, user flows, UI/UX aesthetics, layout constraints, and formal design system requirements or evaluate G2 exemption rationale.",
  "whenToUse": [
    "Initiating a project or feature that includes a user-facing visual interface (Web, Mobile, Desktop, TV, Watch)",
    "Evaluating whether Gate G2 is applicable or whether a formal exemption rationale must be recorded",
    "Translating brand guidelines, mood boards, or Figma mockups into structured design criteria",
    "Discovering responsive viewport requirements and accessibility constraints (WCAG 2.1 AA)"
  ],
  "prerequisites": [
    "Gate G1 approved (requirements contract signed off)",
    "Identified user personas and primary user journeys",
    "Access to design-contract schema in core/schemas/design-contract.schema.json"
  ],
  "inputs": [
    {
      "name": "uiScope",
      "type": "string",
      "description": "Definition of visual interfaces to be created or modified"
    },
    {
      "name": "brandGuidelines",
      "type": "object",
      "description": "Brand aesthetic rules, primary color palette, typography references, and visual tone"
    },
    {
      "name": "targetFormFactors",
      "type": "array",
      "description": "Target devices and viewports (mobile, tablet, desktop, ultra-wide)"
    }
  ],
  "procedure": [
    {
      "stepNumber": 1,
      "title": "Visual Interface Applicability Evaluation",
      "action": "Assess whether the project deliverables include visual user interfaces. If the project is headless, CLI-only, or backend library, formulate the formal G2 exemption record."
    },
    {
      "stepNumber": 2,
      "title": "Aesthetic Direction and Persona Mapping",
      "action": "Map target user personas to visual hierarchy, content density, mood (e.g., modern minimalist, enterprise dense, playful, dark-mode first), and motion philosophy."
    },
    {
      "stepNumber": 3,
      "title": "User Flow and Screen Taxonomy Definition",
      "action": "Enumerate critical user flows, page layouts, modal interactions, navigation hierarchies, and responsive breakpoint requirements."
    },
    {
      "stepNumber": 4,
      "title": "Accessibility Target Formulation",
      "action": "Define required accessibility compliance level (WCAG 2.1 AA standard), minimum contrast ratios (4.5:1 text, 3:1 UI components), keyboard focus behavior, and screen-reader semantics."
    },
    {
      "stepNumber": 5,
      "title": "Design Contract Formulation",
      "action": "Generate contracts/design/contract.json adhering to core/schemas/design-contract.schema.json with initial status UNDER_REVIEW."
    }
  ],
  "expectedOutputs": [
    "contracts/design/contract.json adhering to design-contract.schema.json",
    "Visual discovery summary detailing user flows, responsive viewport tiers, and aesthetic rules",
    "Formal exemption rationale if project has no visual interface"
  ],
  "applicableApprovalGates": [
    "G1",
    "G2"
  ],
  "failureAndRecovery": {
    "potentialFailures": [
      "Ambiguous visual aesthetic leading to contradictory design tokens",
      "Attempting to bypass Gate G2 on visual products without formal justification",
      "Missing accessibility criteria for enterprise products"
    ],
    "recoveryStrategy": "If visual guidelines are ambiguous, present interactive mood options to the user before finalizing tokens. If G2 bypass is attempted for visual apps, reject transition and enforce token formulation."
  },
  "verificationCriteria": [
    "contracts/design/contract.json passes validation against core/schemas/design-contract.schema.json",
    "If isApplicable is false, exemptionRationale is documented with technical justification",
    "If isApplicable is true, all target viewports (mobile, desktop) have explicit breakpoint specifications",
    "Accessibility targets include measurable contrast ratios and WCAG level"
  ],
  "relevantContractsAndMemory": {
    "contracts": [
      "contracts/requirements/contract.json",
      "contracts/design/contract.json"
    ],
    "memoryRecords": [
      "durableKnowledge.codingConventions",
      "executionState.currentGate"
    ]
  }
}
