{
  "skillId": "web-scraping-and-research",
  "name": "web-scraping-and-research",
  "purpose": "Extract, distill, and verify technical documentation, public package registries, and architectural best practices from the web using ethical rate-limiting, clean markdown distillation, and structured metadata extraction.",
  "whenToUse": [
    "Scraping online technical documentation and official API references for third-party libraries",
    "Extracting package registry metadata, release notes, and breaking changes from npm, PyPI, and GitHub",
    "Researching modern architectural patterns, algorithms, and benchmarks from the open web",
    "Distilling web pages and HTML documentation into clean, readable GitHub-flavored markdown",
    "Gathering external intelligence and comparative analyses to support agent development workflows"
  ],
  "prerequisites": [
    "Target URL list or domain research scope",
    "Outbound HTTP fetch, headless browser, or scraping tool capability",
    "Defined extraction schema or markdown output target destination"
  ],
  "inputs": [
    {
      "name": "targetUrls",
      "type": "array",
      "description": "List of target documentation or web page URLs to scrape and distill"
    },
    {
      "name": "extractionScope",
      "type": "string",
      "description": "Target content boundaries (e.g., documentation body, API table, changelog, code blocks)"
    },
    {
      "name": "outputFormat",
      "type": "string",
      "description": "Desired artifact format: markdown, structured JSON, or comparative summary (default: markdown)"
    },
    {
      "name": "rateLimitPolicy",
      "type": "string",
      "description": "Request throttling, concurrency limit, and robots.txt compliance settings (default: polite/ethical)"
    }
  ],
  "procedure": [
    {
      "stepNumber": 1,
      "title": "Robots & Rate Limit Policy Evaluation",
      "action": "Inspect the target domain's robots.txt directives, crawl delay expectations, and concurrency rules to ensure ethical, non-disruptive scraping."
    },
    {
      "stepNumber": 2,
      "title": "HTTP Fetch & Document Retrieval",
      "action": "Retrieve target web documents using standard HTTP GET with browser user-agent headers, fallback handlers, and exponential backoff retry logic."
    },
    {
      "stepNumber": 3,
      "title": "DOM Cleansing & Semantic Isolation",
      "action": "Parse the HTML DOM and strip navigation bars, advertisements, cookie banners, tracking scripts, and footer noise to isolate the primary documentation article."
    },
    {
      "stepNumber": 4,
      "title": "Markdown Distillation & Syntax Normalization",
      "action": "Convert the cleansed HTML DOM into standard GitHub-flavored markdown, preserving language-tagged code blocks, tables, callouts, and relative hyperlinks."
    },
    {
      "stepNumber": 5,
      "title": "Structured Metadata & Source Citation Extraction",
      "action": "Extract publication timestamps, version tags, author metadata, and canonical URLs to construct verifiable provenance records."
    },
    {
      "stepNumber": 6,
      "title": "Validation & Artifact Generation",
      "action": "Validate distilled content against requested schema, verify code examples for syntax errors, and write the distilled files to docs/external-research/ or memory."
    }
  ],
  "expectedOutputs": [
    "Distilled markdown documentation files preserving syntax and code blocks in docs/external-research/",
    "Structured extraction JSON containing metadata and API specs",
    "Source citation manifest recording canonical URLs, HTTP status codes, and retrieval timestamps"
  ],
  "applicableApprovalGates": [
    "G0",
    "G1",
    "G2",
    "G3",
    "G4"
  ],
  "failureAndRecovery": {
    "potentialFailures": [
      "Target site blocks requests with 403 Forbidden, rate limits, or CAPTCHA challenge",
      "Dynamic single-page application (SPA) returns empty HTML skeleton without client-side JavaScript execution",
      "Malformed or noisy HTML produces corrupted, unreadable markdown"
    ],
    "recoveryStrategy": "Switch to official public registry APIs (e.g., npm registry, PyPI JSON API, GitHub raw content), invoke headless browser rendering if client JavaScript is required, or fall back to cached developer documentation archives."
  },
  "verificationCriteria": [
    "Distilled markdown contains valid headers, tables, and fenced code blocks without residual script or style tags",
    "All claims and code samples include verified canonical source URLs and fetch timestamps",
    "Scraping actions strictly adhered to robots.txt rules and ethical concurrency limits"
  ],
  "relevantContractsAndMemory": {
    "contracts": [
      "contracts/project/contract.json",
      "contracts/architecture/contract.json"
    ],
    "memoryRecords": [
      "durableKnowledge.architecturalDecisions",
      "durableKnowledge.domainVocabulary"
    ]
  }
}
