{
  "skillId": "thermo-nuclear-review",
  "name": "Thermo-Nuclear Code Quality Review & Code Judo",
  "purpose": "Conduct an uncompromising, adversarial code audit that aggressively simplifies architecture, collapses redundant indirection, eliminates dead complexity through Code Judo, and enforces the inevitability standard.",
  "whenToUse": [
    "Evaluating code changes at Gate G5 before merging into master or release branches",
    "Auditing code produced by worker or subagent models to eliminate AI slop and boilerplate",
    "Simplifying convoluted logic, deep nesting pyramids, and unnecessary class/wrapper abstractions",
    "Enforcing strict file bloat ceilings and dead code vaporization across all repositories"
  ],
  "prerequisites": [
    "Git diff or modified file trees available for inspection",
    "Access to requirements acceptance criteria or target interface contracts",
    "Automated test suite passing at Gate G4 baseline"
  ],
  "inputs": [
    {
      "name": "targetDiffOrFiles",
      "type": "string",
      "description": "Git diff range, commit hash, or paths to modified source code files"
    },
    {
      "name": "contractRequirements",
      "type": "object",
      "description": "Approved architectural contracts and requirement acceptance criteria"
    }
  ],
  "procedure": [
    {
      "stepNumber": 1,
      "title": "Code Judo Structural Simplification",
      "action": "Inspect class hierarchies and helper functions. Identify trivial pass-through wrappers that forward calls without transformation. Collapse redundant abstractions directly into their calling sites."
    },
    {
      "stepNumber": 2,
      "title": "Cyclomatic Depth & Nesting Flattening",
      "action": "Measure block nesting depth. Enforce maximum nesting depth of 3. Mandate conversion of deep if-else branches and pyramid callback structures into early returns, guard clauses, and focused single-purpose subroutines."
    },
    {
      "stepNumber": 3,
      "title": "File Density & Bloat Ceiling Audit",
      "action": "Measure file line counts. Flag files exceeding 500 lines for structural decomposition; issue hard rejection for single files exceeding 1,000 lines unless authorized by an architectural exception."
    },
    {
      "stepNumber": 4,
      "title": "Dead Code & Defensive Slop Vaporization",
      "action": "Scan for unused imports, unreachable error branches, commented-out legacy code, defensive null checks where types or invariants guarantee non-nullness, and redundant try-except blocks."
    },
    {
      "stepNumber": 5,
      "title": "The Inevitable Code Standard Evaluation",
      "action": "Evaluate readability and cognitive ergonomics: verify that the code reads directly and obviously, with zero premature generalization hooks, speculative configuration flags, or excessive comment chatter."
    },
    {
      "stepNumber": 6,
      "title": "Authoritative Verdict & Simplification Plan",
      "action": "Emit formal verdict (APPROVED or REJECTED) with concrete Code Judo refactoring instructions referencing exact file paths, line ranges, and line savings."
    }
  ],
  "expectedOutputs": [
    "Thermo-Nuclear Review Audit Report detailing Code Judo opportunities, nesting depth metrics, and lines deleted",
    "Formal Gate G5 evaluation verdict conforming to quality-contract.schema.json",
    "List of actionable Code Judo simplification tickets"
  ],
  "applicableApprovalGates": [
    "G5"
  ],
  "failureAndRecovery": {
    "potentialFailures": [
      "Deep cyclomatic nesting exceeding depth threshold 3",
      "Single file exceeding 1,000 lines without modular decomposition",
      "Trivial wrapper layer introducing gratuitous indirection",
      "Gratuitous AI comment chatter or unverified defensive stubs"
    ],
    "recoveryStrategy": "Reject Gate G5 immediately. Output specific Code Judo refactor directives showing exact before-and-after code simplifications. Route back to implementing agent for consolidation."
  },
  "verificationCriteria": [
    "Zero files exceeding 1,000 lines in changed paths",
    "Maximum nesting depth <= 3 across all functions",
    "Zero trivial one-line pass-through wrappers without domain validation",
    "Zero anti-slop violations (BL-001 through BL-007)",
    "Code reads directly and inevitably without speculative abstractions"
  ],
  "relevantContractsAndMemory": {
    "contracts": [
      "contracts/quality/contract.json",
      "contracts/implementation/contract.json",
      "contracts/architecture/contract.json"
    ],
    "memoryRecords": [
      "executionState.activeTasks",
      "backlogAndHistory.technicalDebt"
    ]
  }
}
